Class Index,Title,Description
4,China #39;s Consumer Electronics Market Grows,"China #39;s consumer electronics market will grow by almost 90 percent to \$94 billion by 2007 as manufacturers shift to high-end digital products and away from more basic items like toys and watches, an industry publication forecasts."
1,Peru Says No Attack Planned; 4 Police Dead," LIMA, Peru (Reuters) - The Peruvian government on Sunday  denied planning an imminent offensive after urging residents  living near a captured police station in the southern Andes to  leave their homes."
2,"Colts 49, Texans 14",The Houston Texans made mistake after mistake Sunday and Manning converted them into touchdown after touchdown. Manning completed 18 of 27 passes for 320 yards and threw five touchdowns for the third time 
1,Mixed media: Fingers pointed at Putin,RUSSIAN ON-LINE NEWSPAPER - Questions are mounting about whether Putin #39;s policies - not only in Chechnya but also the power consolidation drive to stamp out opposition and public debate - are exacerbating the terrorist threat.
1,Abducted Aid Worker in Iraq Begs for Life (AP),"AP - Trembling, haggard and weeping into a tissue, Margaret Hassan, the kidnapped British aid worker who has spent nearly half her life delivering food and medicine in Iraq, begged Britain on Friday to help save her by withdrawing its troops, saying these ""might be my last hours."""
2,NHL players stick together despite reality,It was comforting to see Bob Goodenow hasn #39;t changed much in the seven weeks since the National Hockey League began locking out its players.
3,Markets question when Fed will pause on rate hikes,"WASHINGTON : With little doubt about the Federal Reserve #39;s plans for a quarter-point rate hike, financial markets were focusing on another question: When will the Fed stop?"
2,US skier Kildow wins downhill event,"Lindsey Kildow of Vail, Colo., won her first World Cup skiing event yesterday, taking the season #39;s first downhill in 1 minute, 23.44 seconds."
3,Chinese firm in talks for Noranda,"Government-controlled minmetals. Exclusive talks to buy Canadian mining giant that has a market value of \$6.7 billion. Noranda CEO Derek Pannell said he is encouraged by discussions with Minmetals, although "
1,"Nearly a Month Later, Ohio Fight Goes On (AP)","AP - Nearly a month after John Kerry conceded Ohio to President Bush, complaints and challenges about the balloting are mounting as activists including the Rev. Jesse Jackson demand closer scrutiny to ensure the votes are being counted on the up-and-up."
2,China rallies to v-ball win,Ping Zhang had 25 points yesterday as China came from two sets down to beat Russia for the gold medal in Olympic women #39;s volleyball.
4,Google Groups get going,"Google has unveiled the second version of Google Groups, which is designed to make it easier to follow online chat groups. Enhanced tools allow fast searches of the company #39;s Usenet database of online forums, which it bought in 2001."
1,Justice Thomas Hopes for Smooth Election (AP),"AP - U.S. Supreme Court Justice Clarence Thomas said Thursday he would prefer not to face another election-related lawsuit, but defended the high court's decision to get involved in the contentious dispute over the 2000 presidential vote in Florida."
4,Paleontologists Put Ancient Long-Necked Monster in Its Place,"iraffes evolved long necks to browse in trees high above the competition. That is as plain as the explanation the wolf in granny clothing gave Little Red Riding Hood for his big teeth:  quot;The better to eat you with, my dear."
3,Ford Recalls Econoline Vans to Fix Brakes,"&lt;p&gt;\&lt;/p&gt;&lt;p&gt; DETROIT (Reuters) - Ford Motor Co. &lt;F.N&gt; said on Thursday\it is recalling 234,208 Econoline vans in North America to fix\a defect in the anti-lock brake unit that can spark fires even\when the vehicles are parked.&lt;/p&gt;"
1,"American, Nepali, 2 Arabs Kidnapped in Baghdad","Gunmen kidnapped an American, a Nepali and two Arab men from their Baghdad office on Monday, police said.  quot;They stormed the villa with automatic rifles and rocket- propelled grenades."
3,"FAA Must Improve Oversight of Hazardous Materials, Report Says","The Federal Aviation Administration needs to improve its oversight of air carriers and passengers who bring hazardous materials onto airplanes, according to a report released yesterday "
3,"Australia #39;s S amp;P/ASX 200 Falls; Origin Declines, Woodside Climbs",Australia #39;s S amp;P/ASX 200 Index fell for a third day. Origin Energy Ltd. declined after New Zealand #39;s Contact Energy Ltd.
3,Europe awaits US poll verdict,"European shares edged higher Tuesday, with easing oil prices underpinning market sentiment, but investors were cautious ahead of a neck-and-neck race in the US presidential elections."
4,LCD Prices Fell More Than Expected in August,"Large-sized LCD panel pricing fell faster than expected last month, due to disappointing demand, rising supply and swelling inventories that created a near-term headache for suppliers, but also paved the way for stronger sales during Q4, according to "
4,EDS settles contract dispute with U.K.'s NHS,The U.K. National Health Service and Electronic Data Systems reached a settlement after the NHS terminated a contract for the company to supply a secure e-mail and directory system.
3,"United, pilots tentatively agree on additional cuts","United Airlines, seeking cost cuts to help it get out of bankruptcy, has reached a tentative agreement with its pilots union, the first labor accord on additional concessions the carrier proposed last month."
3,Oil steady after failure to hit \$50,Oil prices have steadied after sliding sharply from record highs late last week but the tightening siege on rebels holed up in a shrine in Iraq has heightened uncertainty in the market.
2,"No. 16 Florida 20, Kentucky 3","With Hurricane Jeanne approaching, Florida squeezed in its game against Kentucky and beat the Wildcats 20-3 Saturday behind Ciatrick Fason #39;s career-high 210 yards rushing and two touchdowns."
1,Three Beheaded Bodies Found North of Baghdad," BAIJI, Iraq (Reuters) - The decapitated bodies of three  men, their heads strapped to their backs and the corpses put in  nylon bags, were found dumped by a roadside north of Baghdad  Wednesday, Iraqi police and U.S. officials said."
1,Pro-Democracy Protest in Iran Gains Momentum," TEHRAN (Reuters) - A rare pro-democracy protest in Tehran  gained momentum late on Sunday with hundreds of cars pouring  onto the streets, blaring horns and provoking an appearance  from hardline vigilantes, witnesses said."
4,Co-Founder of Google's Blogger Leaving Company (Reuters),"Reuters - Web search leader Google Inc.\ on Thursday said the head of its Web log service,\Blogger, will leave at the end of the week to pursue other\interests."
1,Iraqis aim to decide new assembly,The national conference on Iraq #39;s future is going into an unscheduled fourth day as delegates hammer out the shape of the first post-war parliament. 
3,"Oil Prices Are at New High, Over \$49"," LONDON (Reuters) - Oil prices raced to fresh highs on  Friday, carrying U.S. crude over \$49 a barrel, driven by  escalating violence in Iraq and unabated fuel demand growth  from China and India."
4,Hollywood Sues Movie Pirates,"Hollywood joined the music industry in its legal campaign against online music piracy, filing hundreds of lawsuits against people suspected of trading illegally copied movies on the Internet. &lt;FONT face=""verdana,MS Sans Serif,arial,helvetica"" size=""-2"" color=""#666666""&gt;&lt;B&gt;-washingtonpost.com&lt;/B&gt;&lt;/FONT&gt;"
4,SGI to upgrade high-end Linux servers next week,"Silicon Graphics plans to announce a new Linux computer Nov. 1, a machine that uses Intel's newest Itanium 2."
4,ISA Server 2000 and Proxy Server 2.0 Internet Content Spoofing,"This update resolves a newly-discovered, privately reported vulnerability. The vulnerability is documented in the Vulnerability details section of this bulletin."
2,Wimbledon Champ Sharapova Wins Japan Open (AP),"AP - Wimbledon champion Maria Sharapova overpowered Mashona Washington 6-0, 6-1 on Saturday to win the Japan Open for the second straight year."
2,NFL: JAMAL #39;S HEADING FOR JAIL,but only after the NFL season ends. The Baltimore Ravens star will serve four months in a tough federal jail and two months in a halfway 
2,Positive Identity Emerges for Giants' Offense,"Most of the credit offensively went to Kurt Warner, the man who delivered the ball and created team chemistry by the way he did it."
2,VENUS NARROWLY AVOIDS UPSET,"Venus Williams barely kept alive her hopes of qualifying for next week #39;s WTA Tour Championships. Williams, seeded fifth, survived a third-set tiebreaker to outlast Yuilana Fedak of the Ukraine, 6-4 2-6 7-6 "
1,Italy braced for general strike,Millions of Italian workers are expected to take part in a general strike against \$8bn in government spending cuts.
1,UN soldier injured in clash with Aristide loyalists,A UN peacekeeper and a Haitian policeman were injured Saturday in a clash with loyalists of former Haitian President Jean-Bertrand Aristide in Port-au-Prince.
1,South Korea on alert for North Korean infiltration,South Korea went on high alert over possible infiltration by North Korean agents Tuesday while US Secretary of State Colin Powell met with top officials in Seoul on how to denuclearize the North and redeploy US troops on the 
3,Holiday traveler outlook: no gifts,"MANATEE - Expect airports and roads to be even more crowded than usual this holiday season. That #39;s the word from AAA, which predicted Wednesday that a record number of Americans and Floridians will travel during the Christmas and New Year #39;s holidays."
1,Iran rejects EU nuclear proposal,"TEHRAN: Iran on Sunday described a European proposal aimed at ending a nuclear standoff as unbalanced and rejected its demands that the Islamic republic halt all uranium enrichment activities, a foreign news agency reported."
1,"An angry Galloway wins 150,000 damages from the Telegraph","GEORGE Galloway yesterday scored another major libel victory, winning 150,000 damages over a newspaper #39;s claims that he was in the pay of Saddam Hussein."
1,US tightens net around Fallujah,United States troops have reinforced positions around Fallujah after an overnight air strike and sealed main roads out of the rebel-held city.
1,Ukraine rivals bid to end crisis,Presidential rivals Viktor Yushchenko and Viktor Yanukovych meet in a fresh bid to resolve the poll crisis.
1,Asem forum to promote co-operation between continents,"HANOI: Eight years after its inception, the Asia-Europe Meeting (Asem) is moving towards becoming a strong platform for promoting more tangible co-operation between the two continents."
4,Card fraud shows sharp increase,"Credit and debit card fraud rose by nearly a fifth to 478.8m in the year up to July, an industry body says."
1,Cypriot govt condemns bomb attack on church,The Cypriot government on Friday denounced a bomb attack that rattled the Church of Agios Mamas Friday morning in the town of Morphou in Turkey-controlled northern Cyprus.
2,Radcliffe and Ramaala Win New York City Marathon,Both Paula Radcliffe of Britain and Hendrik Ramaala of South Africa got a bit of redemption after a disappointing Olympics.
3,Microsoft CEO meets Indian prime minister,Microsoft chief Steve Ballmer brought his campaign to retain his company #39;s dominance in the Indian software market to the country #39;s leadership yesterday.
1,First arrest over Jakarta bombing,Indonesian police have made their first arrest in connection with last week #39;s bombing at the Australian embassy in Jakarta. Police chief Da #39;i Bachtiar said a man had been arrested for carrying explosives for 
2,Trackin #39; the Top 25,"the Georgia #39;s equipment truck arrived at Commonweatlth Stadium enabling the Bulldogs to dress for the game. David Greene, who passed for 259 yards, and Thomas Brown, who rushed for a career-high 130 yards."
1,Dexia formally abandon's merger plans with Italy's Sanpaolo (AFP),AFP - French-Belgian bank Dexia said  that it has decided to terminate its plans to form an alliance with Italian bank Sanpaolo IMI.
4,Survey plea to save stricken owls,The public is being asked to help with a major survey into Britain's owl population.
3,"CHINA PRESS: Shanghai Auto Plans \$6B IPO In HK, New York","BEIJING (Dow Jones)--Shanghai Automotive Industry Corp. (Group), one of China #39;s three major state-run automakers, plans to go public in both Hong Kong and New York in January after a \$6 billion initial public "
4,Briefly: Hitachi unleashes 100GB notebook drives,roundup Plus: Web services security outfits merge...Groups push on for TV on cell phones...Shopping.com holders cut IPO shares.
2,Pacers #39; O #39;Neal might head to injured list,The Indianapolis Star reported Friday that All-Star forward Jermaine O #39;Neal likely will be placed on the injured list due to a strained ligament in his left foot.
3,Stock Futures Drop After Merck News,"US stocks futures tumbled on Thursday after drug company Merck  amp; Co. (MRK.N: Quote, Profile, Research) announced it was recalling a key drug, indicating the market would open lower."
4,Macromedia Sells Web Conferencing By The Minute,com. Macromedia on Tuesday opened up its Breeze Live hosted Web conferencing service to smaller shops by adding pay-as-you-go pricing to the subscription deals it had earlier offered.
1,Two Men Questioned in Pakistan Bombing (AP),AP - Police said Monday they were questioning two men in connection with a suicide attack at a Shiite mosque in eastern Pakistan that killed three people plus the bomber  #151; the latest violence in what appears to be rising strife between Shiite and Sunni Muslims.
4,Hollywood Writer Sues Microsoft Over Yoga Game," LOS ANGELES (Reuters) - Academy Award-winning screenwriter  Roger Avary has sued Microsoft Corp. in California for  purportedly stealing his idea for a virtual yoga studio after  the software giant sought his advice for winning over women to  videogames, his attorney said on Tuesday."
1,US jets target Zarqawi,"BAGHDAD: US fighter jets struck suspected hideouts of Iraq #39;s most wanted man, Abu Musab al-Zarqawi, in rebel-held Fallujah yesterday as interim Prime Minister Iyad Allawi announced plans for a national arms-for-cash program."
1,Judge OKs Rights Suit Against Unocal (AP),"AP - A lawsuit against Unocal Corp. over alleged atrocities that occurred during a 1990s pipeline project in Myanmar can proceed before a jury, a California judge ruled Tuesday."
1,Chinese media demands investment in mine safety,"A woman breaks down after she was told the fate of her husband, one of the miners trapped in the Chenjiashan coal mine in Tongchuan city, north China #39;s Shaanxi province November 29."
2,Red Devils about to confront the Gunners,Don #39;t look for Alex Ferguson and Arsene Wenger to sit down for a drink after today #39;s critical showdown between Manchester United and Arsenal.
1,Kidnappings Dog Kabul 3 Years After Taliban Defeat,"Three UN workers remained hostages of a Taliban faction despite hopes they would be freed by the Muslim festival of Eid which began on Saturday, the third anniversary of the Taliban #39;s flight from the Afghan capital."
1,Yudhoyono makes the cut in Sulawesi,Some 300 people have shaved their heads in Indonesia #39;s Central Sulawesi province to celebrate the victory of former general Susilo Bambang Yudhoyono in this week #39;s presidential election.
1,Columbus' Tomb Opened on Anniversary (AP),"AP - Roman Catholic officials opened a tomb said to contain the remains of Christopher Columbus as part of an annual ceremony Tuesday, a day after the Dominican government denied a Spanish request to conduct DNA tests to determine which country has the navigator's true remains."
4,"U.S. Agencies, Contractors Lead Space Race","At four of the region's largest real estate brokerages, more than half the tenants looking for large chunks of space are government agencies or their contractors, and brokers said the increased competition for space among companies in the booming defense and security industries could mean higher rents."
1,China Ex-President May Be Set to Yield Last Powerful Post,"Jiang Zemin, China's military chief and senior leader, has told Communist Party officials that he plans to resign, two people with leadership connections say."
2,Crisp Sparks Indians,"Coco Crisp's hustling RBI bunt single in the eighth inning pushed the Indians past the Yankees, 4-3, on Wednesday night, ending Cleveland's nine-game losing streak."
4,"Square Enix, Gamemakers Count on Sony, Nintendo to Boost Sales","Square Enix, the world #39;s biggest maker of role-playing computer games, and rivals including Koei Co. are counting on the new consoles from Japan #39;s Sony Corp."
4,Webify Helps Insurance Carriers Stretch Legacy Apps (Ziff Davis),"Ziff Davis - The company's software, built on IBM's on-demand architecture, lets carriers extend the life of legacy applications while pushing out new functionality."
2,Williams contacts Dolphins but says he #39;s headed for India,Retired running back Ricky Williams says he contacted the Miami Dolphins this week at the request of his agent but has no plans to rejoin the team anytime soon.
4,NASA Says Fixing Space Shuttle Fleet Could Top \$2 Billion,"WASHINGTON (AP) -- NASA administrator Sean O'Keefe said Wednesday the cost of fixing all the problems with the space shuttle fleet could top \$2.2 billion - double the estimated price tag given to Congress a year ago.    O'Keefe, testifying before the Senate Commerce, Science and Transportation Committee, was pressed on whether that estimate again could rise..."
2,Jimenez Grabs First-Round Lead at European Masters," CRANS-SUR-SIERRE, Switzerland (Reuters) - Miguel Angel  Jimenez and Sergio Garcia warmed up for this month's Ryder Cup  with sparkling starts at the European Masters on Thursday."
1,Soaring Oil Prices Send Stocks Skidding,"NEW YORK - Soaring oil prices trumped positive earnings news Wednesday, sending stocks skidding as investors rushed to take profits on new fears that the market is in the midst of a commodities bubble.    Stronger than expected profits at chip bellwether Intel Corp..."
3,Boeing reaps \$49M from US error,"Boeing Co. made at least \$49 million in excess profit on a federal aviation security contract because the government failed to properly structure the deal, a federal audit released Monday found."
4,Cassini beams images of Saturn #39;s moon,"This movie taken by the Cassini spacecraft shows the surface and atmosphere of Saturn #39;s moon Titan over a range of infrared wavelengths, from ."
3,Lampert rolls with the risks,"It #39;s all about Eddie. Wall Street is betting Kmart chairman Eddie Lampert will be able to add a successful combination with Sears, the biggest retail merger in history, to his impressive resume."
3,"UPDATE 2-Credit Suisse to integrate units, float Winterthur","Credit Suisse (CSGN.VX: Quote, Profile, Research) will integrate its investment bank Credit Suisse First Boston with its private bank and aims to float its Winterthur "
2,Colts #39; respected coach needs to be heard on issue,"By now, most of us can agree that ABC #39;s  quot;Monday Night Football quot; opening was lasciviously over-the-top, a crass effort at cross-promotion and titillation."
4,IBM Adds New Power5  iSeries Server (Ziff Davis),Ziff Davis - The company introduces a new midrange server and expands management and support across the i5 server line.
4,Open-source process server set for release,More open-source software for businesses: The Apache Software Foundation is launching a project for a Java process automation server.
1,"Bambang: If we lack credibility or integrity, we are worthless",Bambang Harymurti showed no signs of being broken in spirit when a panel of judges at the Central Jakarta District Court found him guilty of libel and sentenced him to a year in prison on Thursday.
4,Brazil to Limit UN Access to Uranium Plant as Powell Visits,"Brazil will limit United Nations #39; access to a uranium enrichment plant as US Secretary of State Colin Powell visits the country to press for unimpeded inspections, the country #39;s ambassador in Washington said."
4,Kerry report: Economy 'threatened' by offshoring,Presidential candidate's position paper calls for expanding a federal program to help tech workers hurt by offshore outsourcing.
2,Lithuania Shoots Down U.S. in Men's Olympic Basketball, ATHENS (Reuters) - Sarunas Jasikevicius went on a shooting  spree in the last three minutes of play to lift Lithuania to a  94-90 victory over the United States in the men's Olympic  basketball tournament Saturday.
4,Nearly Half European Birds Species at Risk -Report (Reuters),"Reuters - Over 40 percent of all bird species\in Europe face an uncertain future and some are so threatened\that they may disappear soon due to intensive agriculture and\climate change, scientists said on Monday."
3,Brookstone Posts a Narrower Loss (Reuters),"Reuters - Brookstone Inc. (BKST.O), a retailer\specializing in gadgets and personal electronics, on Wednesday\posted a narrower quarterly loss on strong Father's Day sales\and raised its profit forecast for the full year."
2,"Even with a patchwork secondary, the Patriots just keep on winning","As both the weeks and the wins pile up for the Patriots, the more preposterous it becomes. Already it #39;s as farfetched and fanciful as anything that has happened in the NFL this season, Ben Roethlisberger #39;s magic carpet ride included."
3,Russia Advances Plans to Break Up Yukos,"Russia moved ahead Friday with plans to break up the country #39;s largest oil producer over unpaid back tax bills, announcing it would auction off a majority stake in the main production unit of oil giant OAO Yukos next month."
2,Yankees return the favor,"The Yankees figure there is no sense looking backward, either at a bad loss or the team behind them in the standings. That is the way they have approached the whole week and it was the way "
2,Padres Defeat Dodgers 9-4 (AP),"AP - Ramon Vazquez and Ramon Hernandez each hit a three-run homer for the San Diego Padres, and Adam Eaton beat Los Angeles for the fourth time this season in a 9-4 victory Tuesday night that cut the Dodgers' NL West lead to 1 1/2 games over San Francisco."
3,Martha Stewart Names Lyne Chief as Patrick Resigns (Update1),"Martha Stewart Living Omnimedia Inc., whose founder is serving a five-month prison sentence for obstructing justice, named Susan Lyne as president and chief executive officer, replacing Sharon Patrick."
1,"Blast, Mushroom Cloud Reported in N. Korea (AP)","AP - A large explosion occurred in the northern part of North Korea, sending a huge mushroom cloud into the air on an important anniversary of the communist regime, a South Korean news agency reported Sunday."
1,US and British forces sweep through Iraq #39;s  #39;death triangle #39;,"LATIFIYAH, Iraq (AFP) - American, British and Iraqi forces continued a major sweep through Iraq #39;s  quot;triangle of death quot; to try to smash rebel enclaves before landmark elections in January."
2,Clippers #39; Brand suspended one game,"New York, NY (Sports Network) - Los Angeles Clippers forward Elton Brand was suspended Tuesday for one game by the NBA for shoving Charlotte #39;s Emeka Okafor during the fourth quarter of Monday night #39;s game."
1,WORLD BRIEFS,"IN AFGHANISTAN. US troops and helicopter gunships killed 22 militants, including three Arab fighters, in the southern province of Zabul, Afghanistan, the military said yesterday."
4,News: Caller ID spoofing service for sale,"The founder of a US Caller ID falsification service is selling up, just days after setting up in business.\"
4,Latest Mozilla releases fix 10 security flaws,"At least three critical vulnerabilities are among those fixed by the most recent versions of Mozilla, Firefox and Thunderbird."
3,Severn Trent lifts dividend as US business suffers,"Severn Trent, the UK environmental services group, said it intended to raise its interim dividend by 2.5 per cent to 18.21p despite a 10 per cent fall in pre-tax profits to 126.2m (\$239m) for the six months to 30 September."
4,Astronomers Contemplate Icy Volcanoes in Far Places,"Hundreds of tiny worlds circling beyond Neptune have been thought of as frozen in time, almost unchanged since they formed at the birth of the solar system five billion years ago."
1,U.S. Pre-Ramadan Raids Net Insurgents,"BAGHDAD, Iraq - Stepping up raids before the Muslim holy month of Ramadan, U.S. forces traded fire with insurgents in the Sunni stronghold of Ramadi, officials said Thursday, while troops detained 10 people, including two suspected insurgent leaders, in a sweep of Baqouba..."
2,Clemens Accepts Astros' Arbitration Offer (AP),"AP - Roger Clemens accepted the Astros' offer of salary arbitration Saturday, meaning he will either pitch for Houston next season or retire."
4,Use PayPal at US iTunes Music Store,"The iTunes Music Store in the US will now accept PayPal for purchases of music downloads, audiobooks and gift certificates. Starting today, iTunes Music Store purchases can be funded through PayPal #146;s virtual wallet, allowing customers to pay in the way they prefer  #151; using a credit card, bank account or stored account balance. Dec 10"
4,"Sun Changes Course, Releases First NAS Box","SEPTEMBER 20, 2004 (COMPUTERWORLD) - Sun Microsystems Inc. tomorrow plans to announce several storage products, including its first network-attached storage (NAS) box and a midrange disk array that uses virtualization "
4,Mozilla fixes browser bugs,"Mozilla Foundation releases new versions of two browsers and an e-mail reader, addressing vulnerabilities that could allow attackers to run malicious code on a user's PC."
