Class Index,Title,Description
3,PM arrives for India-EU summit,Prime Minister Manmohan Singh arrived on Sunday night to participate in the India-European Union summit during which a proposal for a strategic partnership will be finalized.
1,Big fall in corruption in Kenya,"The Kenyan government's campaign to tackle corruption is having an impact, says Transparency International."
3,Update 1: JPMorgan to Rehire Outsourced Workers,"JPMorgan Chase  amp; Co. says it will rehire 4,000 workers whose jobs it had outsourced to IBM, bucking a corporate trend in information technology."
4,Sony u-turn over MP3 music files,"Sony says its digital music players will now play MP3 music tracks, and not just its own format."
2,Ruud to the rescue,"Man Utd needed a Ruud van Nistelrooy double to secure a 2-2 draw away to Lyon in their Champions League opener. Utd were heading for a stunning defeat until the intervention of the Dutch goal machine, who "
3,Global Growth Key to Beer Wars,"Anheuser-Busch teams up with Vietnam's largest brewer, laying the groundwork for future growth in the region."
1,"Floyd Norris: \$, , : Some historical perspective","The dollar is down, and a lot of the developed world is worried that this could mean the end of economic recoveries. In Europe, where the euro is routinely said to be setting new record highs, governments "
3,Damages claim against FT  #39;too uncertain #39;,Collins Stewart was seeking damages against the FT on an unprecedented basis when it claimed it should be compensated for the loss in its share price.
2,"Ganguly wants Sehwag, Yuvraj to strike form","Southampton, September 12: The Indian team might have regained its momentum with an easy victory over Kenya in their ICC Champions Trophy opener, but captain Sourav Ganguly wants batsmen Virender Sehwag and Yuvraj Singh to strike form before the crucial "
1,"1,400 dead or missing in Philippine storms",Stranded passengers from the devastated towns of Real and Infanta rush to board an outrigger boat December 6. Food and water shortage forced residents to flee to other province and Manila as roads to Real and other towns destroyed by flash floods and 
4,Dell introduces new compact desktop PC,It's the first Dell PC to feature a multiformat expansion card reader.
3,Enron Broadband Chief Makes Deal,"The chief operating officer of Enron Corp.'s failed Internet unit pleaded guilty yesterday to a single criminal conspiracy charge and agreed to cooperate with the government, as prosecutors continued to build their case against the Houston energy company's top leaders."
3,7 More Managers Fired Over Nortel Accounting,"The company announced the firings on Thursday along with a restructuring plan that included layoffs of about 3,500 employees."
1,UK confirms Briton killed in Saudi capital,"The British Foreign Office confirmed on Thursday that a British man had been shot dead in the Saudi capital Riyadh. His relatives had not yet been informed as further information was being sought, the Foreign Office said."
1,Russia Reports Evidence of Terror Attack,The Russian government abruptly shifted gears Friday and concluded that at least one of the two planes that fell out of the sky almost simultaneously this week was blown up 
4,"Mayhem, for fun","I admit to being skeptical that the Teen-rated Burnout 3: Takedown, from Criterion Games and Electronic Arts, was going to be just another street-racing title."
3,Federal Reserve lifts target rate to 2.25,Federal Reserve policy-makers raised the benchmark US interest rate a quarter point to 2.25 per cent and restated a plan to carry out 
3,Credit Suisse to Overhaul First Boston Operations,Credit Suisse Group announced yesterday that it would integrate its Credit Suisse First Boston investment banking arm into the parent company over the next two years in an effort to create a  quot;more focused franchise.
2,"1914 Baseball Card Set Sells for  #36;800,000 (AP)","AP - A complete set of 1914 Cracker Jack baseball cards featuring ""Shoeless"" Joe Jackson and Ty Cobb has been sold for a record  #36;800,000."
2,"Another slow start, another fast finish for US women","South Korea took an early lead, so did the Czech Republic. Hey, even New Zealand had the US women #39;s basketball team down for a while. "
4,SGI Launches Linux Workstation (NewsFactor),"NewsFactor - High-performance computing specialist SGI (Silicon Graphics) has launched a line of Linux-based visualization machines, providing the company's cutting-edge graphics capabilities on an open platform for the first time."
3,Europe starts new Microsoft probe,The European Commission has opened a probe into Microsoft #39;s and Time Warner #39;s plans to buy anti-piracy software manufacturer ContentGuard.
1,"Cheers Greet Rescuers in Aceh, Children Suffer"," BANDA ACEH, Indonesia (Reuters) - U.S. helicopters shuttled  injured refugees, many of them children, out of some of the  worst hit parts of tsunami-devastated Aceh province, even as  reports surfaced of trafficking in orphans from the disaster."
3,Fidelity still fighting independent chair rule,"Fidelity Investments hasn #39;t given up its opposition to a rule that requires the boards of mutual funds to have an independent chair, and the senior US senator from New Hampshire is backing that effort."
4,Feedster Includes Kanoodle Ads in RSS Feeds,"Feedster Includes Kanoodle Ads in RSS Feeds\\Feedster, Inc. today announced the launch of its RSS feed media program. The Company rsquo;s RSS search feeds will soon contain context targeted ads from Kanoodle, Inc., a leading provider of sponsored links for search results and content pages. Alternatively searchers may opt to pay ..."
4,DSL Leads the Broadband Boom,"High-speed Internet access is becoming more and more popular, study shows."
4,Netscape Revamped With Mozilla 1.7,"Netscape Communications has released Netscape 7.2, successor to the older version 7.1, which was released in mid-2003. The new release is based on version 1.7 of Mozilla, the most recent version of the Mozilla Internet application suite. "
1,"Republicans, Democrats Swap Louisiana House Seats (Reuters)",Reuters - The 2004 U.S. elections ended on\Saturday with Republicans and Democrats swapping one U.S. House\of Representatives seat each in runoff elections in Louisiana.
1,Israel Kills Two Hamas Militants After Renewed Threat, GAZA (Reuters) - Israeli air strikes killed two Hamas  militants in Gaza on Thursday just after the Islamic group  renewed its threats to continue rocket attacks against Israelis  despite a massive army offensive aimed at stopping them.
1,F1: BAR sets pace in China,BAR's Anthony Davidson and Jenson Button set the pace at the first Chinese Grand Prix.
1,"Bin Laden Videotape Fires Up Bush, Kerry (AP)","AP - John Kerry criticized President Bush on Friday for failing to capture Osama bin Laden as a new videotape of the terrorist leader surfaced just before the election. Bush accused the Democrat of ""shameful"" second-guessing in the face of threats by America's deadly foe."
1,Ill. Plans Online Network to Import Drugs,"CHICAGO - Ignoring a federal ban on prescription drug imports, Illinois' governor announced Tuesday that the state would have an online clearinghouse running within a month to help residents purchase drugs from Canada, Ireland and the United Kingdom.    The state won't import the drugs itself, but plans to contract with a Canadian company to connect state residents with foreign pharmacies that have been approved by state health inspectors..."
2,NHL All-Star Shoots for Place on Greek Bobsled Team," NEW YORK (Reuters) - All-star defenseman Chris Chelios, a  two-time Stanley Cup winner with the Detroit Red Wings, will  train with the U.S. bobsled federation next week in a bid to  compete for Greece at 2006 Turin Olympics."
3,Greenspan sceptical about central bank intervention on forex markets (AFP),AFP - US Federal Reserve Chairman Alan Greenspan appeared to be sceptical about the efficacy of any central bank intervention to prop up the dollar.
1,Australia: Second Cell Poised for Indonesia Attack," SYDNEY, Australia (Reuters) - Militants behind the deadly  bombing of Australia's Jakarta embassy have a second group  poised for attack, Australia's top policeman warned as Canberra  said on Saturday all its diplomatic missions would be made  bomb-proof."
3,Verizon: No Imminent Plan for Sprint Bid," PHILADELPHIA (Reuters) - Verizon Communications Inc. has  eyed a potential acquisition of Sprint Corp. &lt;A HREF=""http://www.investor.reuters.com/FullQuote.aspx?ticker=FON.N target=/stocks/quickinfo/fullquote""&gt;FON.N&lt;/A&gt;, but has  no imminent plans to make a bid, people familiar with the  situation said on Tuesday."
3,Back Tax Bill Against Yukos Is Increased,The revised bill raises by \$700 million the Russian government's previous \$3.4 billion estimate of back taxes for 2001.
3,Stocks Edge Lower As Oil Prices Climb,Stocks edged lower Wednesday as investors weighed rising oil prices against a pair of government reports that gave a mixed picture about the economy.
2,"Yao Ming faces francis, Rockets routed by Magic","The Houston Rockets have been beaten 95-72 in a pre-season game Sunday by the Orlando Magic, led by former Rockets guard Steve Francis."
1,Pope makes final journey of year,The Pope will visit Italy's Adriatic coast for a beatification ceremony in his last journey of the year outside Rome.
1,"Gunmen Kill 4, Seize Weapons in Russia's Caucasus", MOSCOW (Reuters) - Islamic militants killed four anti-drugs  unit members and seized more than 170 submachine guns and  pistols on Tuesday in an attack on the unit's offices in  Russia's volatile Caucasus region.
1,Man Finds 3 WWI Troops' Bodies in Glacier (AP),"AP - An amateur Italian historian has found the preserved bodies of three Austro-Hungarian soldiers in an Alpine glacier, 86 years after they were killed in World War One."
2,United punks have little to sing about,"This was punk against opera, and punk won. Manchester United against Arsenal now has all the fervour and spite of the Buenos Aires derby, Barcelona against Real Madrid or Fenerbache v Galatasaray."
1,Defiant Sharon sets out Gaza plan,Israeli PM Ariel Sharon pushes ahead with an accelerated plan to withdraw from the Gaza Strip despite opposition.
1,Courtney Love Sued by LA Travel Agency,"SANTA MONICA, Calif. - Rocker Courtney Love was sued Thursday by a travel agency that claims she ordered nearly \$50,000 in airline tickets, but wouldn't pay..."
2,Expos #39; Season Appears to Be Winding Down for Last Time in Quiet &lt;b&gt;...&lt;/b&gt;,"The final days of the Montreal Expos are painful to watch. Few do. When the scattered fans at Olympic Stadium try to rally the team, they bang the empty seats beside them."
1,Journalists journey into the center of the storm,"NAJAF, Iraq  What we were about to do was more than risky. It was foolish. Thursday, several journalists began organizing a delegation to enter the Imam Ali shrine in ..."
1,"Haiti Storm Toll Tops 1,500; 900 Missing","GONAIVES, Haiti - The staggering death toll from Tropical Storm Jeanne shot upward to an estimated 1,500 people Saturday, with 900 Haitians still missing as a thunderstorm drenched the homeless who are living on rooftops and sidewalks.    U.N..."
4,Group to Propose New High-Speed Wireless Format (Reuters),"Reuters - A group of technology companies\including Texas Instruments Inc. (TXN.N), STMicroelectronics\(STM.PA) and Broadcom Corp. (BRCM.O), on Thursday said they\will propose a new wireless networking standard up to 10 times\the speed of the current generation."
4,"At Google, Earnings Soar, and Share Price Follows",Google's already soaring stock price rocketed even higher after reporting strong growth in its first quarter as a public company.
2,Barca extend Spanish lead,Barcelona held off a spirited comeback by newcomers Getafe to claim a nervous 2-1 win and cement their hold on the leadership of the Primera Liga on Saturday.
3,Dollar #39;s fall worries Japanese officials,Masatsugu Asakawa has one of the busiest jobs in Tokyo these days: monitoring the US dollar #39;s fluctuation against the Japanese yen.
3,US broker faces credit downgrade,"MARSH  amp; McLENNAN, the worlds biggest insurance broker, was last night facing a potentially crippling downgrade of its credit rating by Standard  amp; Poors, after its borrowing power was all but frozen by its bankers."
3,Oil hits \$47 as supply worries,"LONDON - Oil prices hit \$47 a barrel yesterday, the highest level in a month, as China showed no let-up in its strong import growth and US Gulf producers reported damage to offshore rigs from Hurricane Ivan."
1,"Japan Will Act on Yen Gains If Necessary #39;, Tanigaki Says","Japan will take action if necessary #39; #39; to stem the yen #39;s gains against the dollar and is keeping a close watch on currency markets, Japan #39;s Finance Minister Sadakazu Tanigaki said."
3,"AT amp;T to Cut 7,400 More Jobs, Take \$11.4 Bln Writedown (Update3)","AT amp;T Corp. said it will cut 7,400 more jobs this year and write down \$11.4 billion of assets as the phone company retreats from the residential business it once dominated."
3,"Hollinger Committee Files Report on Black, Directors (Update1)","Hollinger International Inc., publisher of the Chicago Sun-Times, said a committee of its board investigating allegations of wrongdoing against former Chief Executive Conrad Black filed a report with a court in Chicago."
4,Apple Launches iTunes Music Store in Canada," SAN FRANCISCO (Reuters) - Apple Computer Inc. on Thursday  launched its iTunes online music store in Canada, the 14th  country in which the popular service is available."
2,Review: New  #39;Hawk #39; game most thorough ever,There #39;s only one thing better than riding a halfpipe ramp in  quot;Tony Hawk #39;s Underground 2 quot; - doing it in real life.
1,Iraq to Widen Arms-for-Cash Program,"BAGHDAD, 19 October 2004 - Buoyed by the apparent success of a Baghdad arms-for-cash program, Iraqs interim government yesterday announced plans to extend it to all of the country ahead of scheduled January elections."
4,IBM tightens up WebSphere,"Big Blue beefs up its WebSphere 6 application server, promising better performance, reliability and simplified administration."
2,Jefferson pledges to stay hungry,Richard Jefferson promises to still be the first one in and the last one out every practice. This from a guy who has played more basketball than any NBA player over 
2,Late Bogies Hurt Woods at Rainy NEC Invitational," AKRON, Ohio, Aug 19 (Reuters) - Tiger Woods returned to  form at one of his favorite venues before a pair of dropped  shots cost him a share of the lead at the weather-affected  WGC-NEC Invitational on Thursday."
2,"Federer, Near-Perfect, Wins US Open Against Hewitt (Update2)","Roger Federer got off to an almost- perfect start and beat Lleyton Hewitt 6-0, 7-6 (7-3), 6-0 for the championship at the US Open, his third Grand Slam title of the year."
2,Emirates Airlines signs sponsorship deal with Arsenal,"According to the deal, the new 60,000-seater ground at Ashburton Grove will be named the Emirates Stadium. The contract also makes Emirates the Gunners #39; shirt sponsor for eight years - starting in 2006-07."
2,Montoya wins final F1 race of season,"Colombia #39;s Juan Pablo Montoya won Sunday #39;s Brazilian Grand Prix, foiling the hopes of native son Rubens Barrichello and his Ferrari teammate Michael Schumacher of Germany."
1,Putin clears way for Kyoto treaty,Russian President Vladimir Putin has signed the Kyoto protocol on climate change - clearing the way for the treaty to come into force next year.
4,Taking the Pulse of Planet Earth,"Scientists are planning to take the pulse of the planet -- and more -- in an effort to improve weather forecasts, predict energy needs months in advance, anticipate disease outbreaks and even tell fishermen where the catch will be abundant."
1,Official Alleges 17 Mass Graves in Serbia (AP),"AP - Serbian territory has 17 mass graves containing bodies of ethnic Albanians slain during Kosovo's 1998-99 war, a former interior minister said Friday, accusing current authorities of a cover-up."
2,Kite maintains lead in Sonoma,"Hatalsky #39;s 5-under 67 was the best round among the leaders, but Kite stayed in front at 10-under 134 with an afternoon of saves and clutch putting -- though he didn #39;t know it at the time."
2,McCain threatens legislation to curb drugs in baseball,"com Staff  December 4, 2004. US Sen. John McCain (R-Arizona) said yesterday that he will introduce legislation for mandatory drug testing of athletes if major league baseball players and owners do "
2,Sutton strikes out as Ryder Cup captain,"BLOOMFIELD TOWNSHIP, Mich.Former US Ryder Cup captain Curtis Strange was criticized in 2002 for holding his best players out until the final Sunday singles matches."
3,Retail Sales Edge Up as Car Sales Dip, WASHINGTON (Reuters) - The U.S. economy showed signs of  strength with the release of stronger-than-expected retail  sales data on Monday that helped cement views the Federal  Reserve will raise interest rates again this week.
3,Rupert blinks as the ISS giant awakes,Rupert Murdoch #39;s brazen attempt to relocate to dodgy Delaware is in big trouble and the world #39;s most powerful man has blinked.
4,Saturn #39;s Moon Titan May Hold Methane Lake,"Cassini has photographed icy volcanic flows and a large lake of what could be methane on Saturn #39;s mysterious moon Titan. The observations suggest Titan is geologically active and, and its environment "
1,Dalai Lama Arrives in Southern Russia (AP),AP - The Dalai Lama arrived Monday for his first visit to Russia in 10 years after Moscow abruptly reversed its refusal to grant the Tibetan spiritual leader entry.
3,Toyota: Resistance Is Futile,"Here #39;s a theme you #39;ll be reading variations on for years to come: Toyota Motors (NYSE: TM) as Borg. (No, not the Stock Advisor pick, Borg Warner (NYSE: BWA)."
2,NFL Game Summary - Jacksonville At Tennessee,"Nashville, TN -- Fred Taylor scored on a one-yard run with nine seconds left in the fourth quarter to lift the Jacksonville Jaguars to a 15-12 victory over the Tennessee Titans at The Coliseum."
1,Musharraf wants India to meet Pak halfway,"PTI Lahore Nov 20: Visibly unhappy at Indias assertion that it would not accept redrawing of the borders in Jammu and Kashmir, the Pakistan President, General Pervez Musharraf today accused New Delhi of adopting a patronising attitude, dismissing "
1,Blasts Kill Five in Baghdad's Green Zone,"BAGHDAD, Iraq - Insurgents penetrated Baghdad's heavily fortified Green Zone and detonated explosives at a market and a popular cafe Thursday, killing five people, including four Americans, in the first bombing inside the compound housing the U.S. and Iraqi government headquarters..."
1,Violence Breaks Out All Over Baghdad,"Iraqis chant anti-US and anti-government slogans in front of a US tank after a car bomb exploded killing at least one person in central Baghdad Saturday, Nov. 20, 2004."
4,"Congress Puts Hooks in Spyware, Copyright Crooks (washingtonpost.com)","washingtonpost.com - Congressional lawmakers are taking a cue from Hollywood with an aim to beef up penalties against people who illegally swap copyrighted movies and songs over the Internet. Meanwhile, lawmakers also are targeting spyware and hackers with the threat of jail time for evil cyberspace deeds."
1,'Orange' victory sours east Ukraine,The political crisis has stung people in Donetsk and could deeply aggravate the nation's east-west divide.
3,China to Let Individuals Trade in Gold,"China #39;s gold-crazed masses will be allowed to trade in the precious metal under reforms that will upgrade trading on the country #39;s nascent market, state media reported Tuesday."
4,Ireland cracks down on net scams,"Ireland is taking  quot;extraordinary quot; measures to protect internet users from rogue dialler programs that hijack their modems and run up long-distance phone charges, the country #39;s telecom regulator says."
3,Google Lowers Its Sights as Demand Proves Weak,"Google's final share price was \$85, far off the target range of \$108 to \$135 a share that the company projected last month."
3,Oil's Rally Takes U.S. Crude Over \$52," LONDON (Reuters) - Oil's record-breaking rally took U.S.  crude over \$52 a barrel on Wednesday, a new all-time high,  fueled by the impact of Hurricane Ivan on U.S. winter  inventories."
4,EDWARD C. BAIG,Steve Jobs is a master when it comes to figuring out ways to help the masses savor songs digitally. Now Apple #39;s boss is counting on a new lightweight mobile base station called AirPort Express to continue to bang the drum for digital music.
2,Vieira plays down bus fracas with Lauren,"ARSENAL captain Patrick Vieira admitted yesterday that there was a  quot;disagreement quot; between him and team-mate Lauren in midweek, but insisted the team spirit at Highbury is  quot;fantastic quot;."
3,Court Throws Out Hollinger Int'l Lawsuit," NEW YORK (Reuters) - A U.S. court on Friday dealt a blow to  Hollinger International Inc.'s &lt;A HREF=""http://www.investor.reuters.com/FullQuote.aspx?ticker=HLR.N target=/stocks/quickinfo/fullquote""&gt;HLR.N&lt;/A&gt; efforts to recover \$1.25  billion from ex-chairman Conrad Black and others, dismissing  its racketeering lawsuit against them."
3,Woolworths tops rival pubs offer,"Retailer Woolworths raised its bid Thursday for Australian Leisure  amp; Hospitality Group (ALH) by 15 percent to Aust. \$1.11 billion (\$795 million), topping an offer by private equity firm Newbridge Capital."
2,Seattle #39;s Fortson suspended over foul,Seattle forward Danny Fortson was suspended for one game without pay after a foul in Friday #39;s game against Toronto was upgraded to a flagrant.
1,Zarqawi group renews threat to kill British hostage (AFP),AFP - An Al-Qaeda linked group in Iraq holding Briton Kenneth Bigley has renewed a threat to kill him unless London meets the kidnappers' demands.
3,Dynegy inks \$1B deal to buy Exelon assets,"Houston-based Dynegy Inc. has agreed to buy ExRes SHC Inc., the parent company of Sithe Energies and Sithe Independence LP, from Chicago-based Exelon Corp."
3,"Crude Sets Record, Nigeria Concerns Mount",&lt;p&gt;\&lt;/p&gt;&lt;p&gt; By Richard Mably&lt;/p&gt;&lt;p&gt; LONDON (Reuters) - London crude prices hit record highs on\Monday as Nigeria emerged as the new focus of worries about\supply security on world oil markets.&lt;/p&gt;
2,Ogunleye Remains Idled in Contract Talks (AP),"AP - Idled by a stalemate in contract negotiations, Pro Bowl defensive end Adewale Ogunleye can only wonder where he'll be come September."
3,"IDC raises 2004 PC growth view, but trims 2005","Shipments of personal computers this year will be higher than previously anticipated, boosted by demand from businesses, research firm IDC said Monday."
1,Responsibility taken for school siege,"In an Internet posting, a Chechen warlord with a \$10 million bounty on his head has apparently claimed responsibility for the Beslan school siege "
4,Crucial TV test for Microsoft,Comcast trials will provide a big clue about the software giant's prospects for cable success.
1,Senegal Draws Up Locust Battle Plan for West Africa,"Only a military-style operation with bases across West Africa can stop the worst locust invasion for 15 years destroying vital food supplies, Senegal #39;s President Abdoulaye Wade said Tuesday."
1,"Abu Ghraib Report Cites Military Leadership Failures, NBC Says",A Pentagon commission found that top US military commanders bear some responsibility for abuses at the Abu Ghraib prison in Iraq because they failed to recognize deteriorating performance 
4,iRiver H10,"Finally, the wait is over. After a long wait, iRiver has finally decided to challenge the might of Creative and Apple in the 5 GB portable music player department."
3,Univ. of Phoenix pushes ahead,"The University of Phoenix disputes the government #39;s portrait that it sells education with the zeal of a hard-charging telemarketer, but recent memos to recruiters reveal tactics similar to those recently cited by federal regulators."
4,Ignore arctic warming warnings at our own peril,"D uring the past few weeks two news events of global importance have occurred that have received extensive international press coverage: the election of George Bush to lead the United States for four more years, and the death of Yasser Arafat, leader of "
2,"Tomjanovich, Lakers have a big night","The Lakers blew a 22-point lead they held in the third quarter but still managed to give Tomjanovich a win over his former team. In an emotional pregame ceremony, Tomjanovich was honored "
4,Sun to Introduce Newest Version of Solaris Today,Sun Microsystems plans to unveil on Monday the latest version of its flagship Solaris operating system. It also intends to offer a free version of the program to 
2,No. 23 Iowa Crushes Centenary 88-53 (AP),"AP - Pierre Pierce scored 19 points and No. 23 Iowa continued to dominate in its own tournament, rolling to an 88-53 victory over winless Centenary on Friday night in the first round of the Hawkeye Challenge."
3,Delta #39;s position still precarious,"Georgia #39;s homegrown Delta Air Lines has scratched and clawed for three years now, trying to gain every concession it deemed necessary to avoid filing bankruptcy."
4,Pay-as-you-go software licensing going slow,Pricing plans designed to let companies pay only for what they actually use are proving difficult to pull off.
2,Japan #39;s Women Wrestlers Win 2 Golds; Medal Count Sets Record,"Japan #39;s women wrestlers added four medals, including two golds, to lead the country to a record Olympic performance and be within one gold medal of its biggest haul of championships."
2,Sampanis denies doping,GREECE #39;S first Athens medallist Leonidas Sampanis today denied taking banned substances despite testing positive for the male hormone testosterone.
