Class Index,Title,Description
2,"Fitzpatrick, Harvard are thinking big","Recently named one of 16  quot;players to watch quot; for the 2004 Walter Payton Award, senior quarterback Ryan Fitzpatrick looks to lead the Harvard football team to its first Ivy League title since 2001."
2,"Galaxy, Rapids to get reacquainted quickly","Although they met four times in the regular season, the Los Angeles Galaxy and Colorado Rapids don #39;t know each other that well heading into their first-round playoff "
3,Gateway to Buy Back Shares From AOL,Computer maker Gateway Inc. on Tuesday said it agreed to buy back about \$316 million of its stock from Internet provider America Online Inc.
1,Spain arrests militant suspects,Spanish police detain several suspected Islamic militants in a series of pre-dawn raids in Barcelona.
2,Hewitt beats Muller to take 3rd title of season,"WASHINGTON: Australias Lleyton Hewitt further fine-tuned his game ahead of the US Open with a convincing 6-3, 6-4 win on Sunday over Gilles Muller to capture the \$500,000 Legg Mason Classic."
1,Iraq donors vow to speed up funds for reconstruction,Donor nations wrapped up a two-day meeting Thursday with pledges to speed up projects to rebuild Iraq possibly by using more Iraqis to implement 
2,McNair Deactivated for Tennessee Titans (AP),AP - Tennessee quarterback Steve McNair missed a second straight start Monday night and his fifth this season because of his bruised sternum.
2,DON #39;T WRITE OFF UNITED - POBORSKY,Manchester United #39;s performances have been a let-down over the past 18 months but Old Trafford old-boy Karel Poborsky is certain a massive change in fortune will not be long in coming.
3,Oil Holds Big Gains on U.S. Fuel Concerns, NEW YORK (Reuters) - Oil prices held Wednesday's 6 percent  gains on Thursday on fears over U.S. fuel supplies ahead of the  northern winter.
2,No Moose sightings in extras,"Unlike their red-stockinged rivals, the Yankees weren't going to use their next scheduled starter -- Mike Mussina -- to relieve if things went bad early last night."
4,Samsung Introduces First 5-Megapixel Camera Phone,Samsung is turning up the heat in the mobile camera phone market with the introduction of the world #39;s first mobile phone with a 5-megapixel camera onboard.
2,Middlesbrough Football Club boss hails perfect team,Steve McLaren was delighted with his Middlesbrough Football Club players after their 2-0 win over Lazio last night.  #39;Boro won the game 2-0 with goals in each half from Dutch international Bolo Zenden and could 
4,Apple Xserve RAID upped to 5.6 terabytes (MacCentral),"MacCentral - Apple on Tuesday announced that its Xserve RAID storage system is now available with up to 5.6 terabytes (TB) of storage capacity -- up from 3.5TB in previous models. Apple has also received certification for the Xserve RAID from Cisco and SUSE Linux, and has optimized the RAID system to work with Apple's own Xsan Storage Area Network (SAN) file system."
2,Iowa Expecting Capital One Invitation (AP),AP - Here's some advice from the Capital One Bowl for Iowa fans thinking about reserving flights to Orlando: Book them.
3,How to Pay for College,Richard Gibbons offers a simple strategy to ensure that your child can go to college.
2,Pats set NFL record with 19th straight win,"Foxboro, MA (Sports Network) - Tom Brady threw for a pair of scores and Corey Dillon ran for 94 yards, as the New England Patriots set an NFL record with their 19th consecutive victory in a 24-10 triumph over the winless Miami Dolphins at Gillette Stadium "
2,Kewell confident over fitness,Harry Kewell says he will be fit for Liverpool #39;s match against Fulham this weekend after suffering a foot injury while playing for Australia.
3,States face Medicare drug price handicap,"Some states are paying far higher prices than others for prescription drugs under the Medicaid program, but data that would help them get a better deal are kept confidential by the federal government, a new report says."
1,Montenegro quits Hague panel in protest,"LJUBLJANA, Slovenia The Montenegrin members of a Yugoslav government panel set up to improve relations with The Hague resigned Thursday to protest what they described as Serbia #39;s failure to hand over suspected war criminals to the international war crimes "
4,"You're Athletes, Not Journalists","Olympians can do media interviews but they'd better not blog. The International Olympic Committee, interested in protecting lucrative broadcasting contracts, forbids any activity that might upset the networks."
2,Tennis: Roddick joins Federer in Bangkok semi-finals,"BANGKOK : Andy Roddick laid on a 21-ace performance to crush Thomas Johansson 6-3, 6-4, moving past jet-lag and into the semi-finals of the 550,000-dollar Thailand Open."
1,Corruption on the rise,"India has slipped further in the Corruption Perceptions Index (CPI) and is ranked 90th on a list of 146 countries, according to Transparency International ratings released today."
3,NZ stocks: Corporate news buoys sharemarket,The was plenty of news but not much in the way of price movements on the sharemarket today. The benchmark NZSX-50 gross index was up 6.50 points to 2861.
1,Family Crisis in Divided Sudan,"His gut was twisted into a knot, his head pounding, his leg searing in pain from a gunshot wound. Ibrahim Mohamed Doud, a village elder in an African tribe, remembers the day an "
4,Electronic Back-Seat Driver System to Be Tested (Reuters),Reuters - Drivers may soon have no excuse for\ignoring road signs.
1,France Cautious About Purported Iraq Hostage Talks (Reuters),Reuters - France was torn between hope and doubt\about its two hostages in Iraq on Wednesday after a purported\French negotiator announced their imminent release but\officials insisted they knew nothing about his efforts.
4,VA Improves Health Benefits for Ex-POWs (AP),"AP - All former U.S. prisoners of war who suffer from heart disease or stroke will receive government health care benefits without having to prove the ailments were linked to their captivity, Veterans Affairs Secretary Anthony Principi said Saturday night."
1,Wen Ho Lee Reporters Held in Contempt,"WASHINGTON - A federal judge held five reporters in contempt Wednesday for refusing to identify their sources for stories about Wen Ho Lee, a former nuclear weapons scientist once suspected of spying.    U.S..."
2,Marlins welcome back Leiter,"CBC SPORTS ONLINE - After spending the last seven seasons with the New York Mets, Al Leiter was feeling a little nostalgic. Leiter signed a one-year contract with the Florida Marlins, a team he helped lead to a World Series title in 1997."
3,India test-fires new supersonic missile,"NEW DELHI: India test-fired a supersonic cruise missile yesterday, launching it off the Indian coast, a local news agency reported."
4,"Nokia pulls out, Sony Ericsson goes in","STRANGE. THE DAY after Sony Ericsson announces it has done a deal with the Financial Times (FT) to offer content via its portal, Nokia says it is reigning back its own portal, Club Nokia."
2,Ponting Hails  #39;Gladiator #39; Symonds,Andrew Symonds second one-day international hundred was the lynchpin of Australias 10-run NatWest International win over Pakistan - and the source of great personal satisfaction 
4,Microsoft Taking on Apple's Music Store,"Microsoft Corp., hoping to take a bite out of Apple Computer Inc.'s highly popular online music service, is gearing up to launch its own Web site for selling songs over the Internet."
3,"UAL, Creditors Agree to 30 Day Extension"," CHICAGO (Reuters) - United Airlines on Friday said it has  agreed with its creditors' committee to a 30-day extension,  subject to court approval, of the period during which it can  exclusively file a bankruptcy reorganization plan."
4,3 Yanks Share Nobel for Physics,"Thirty years of research into the forces that hold everything together pay off grandly for the three Americans, and science moves a step closer to a grand unified theory of the universe."
3,Mutual Funds Quarterly,"Everywhere they look, uncertainty looms - from the Iraq war to the choice of president to the nation #39;s slow-motion recovery. The cautious outlook has led to cautious action, which could be seen in the fairly "
4,Web TV Tries to Seize New Territory,"Contenders are trying novel twists on sending video over the global computer network in an effort to exploit the increasing number of in-home high-speed Internet links. &lt;br&gt;&lt;FONT face=""verdana,MS Sans Serif,arial,helvetica"" size=""-2""\ color=""#666666""&gt;&lt;B&gt;-The Washington Post&lt;/B&gt;&lt;/FONT&gt;"
3,"GM, Euro labor debate 12,000 layoffs","Outraged workers in Germany refuse to resume production as automaker seeks to save \$623.8Ma year. FRANKFURT, Germany (Reuters) - General Motors management started negotiations with union leaders Monday over "
4,FCC Asks Supreme Court To Rule on Broadband,The Federal Communications Commission (FCC) has asked the Supreme Court to hear an appeal that could determine whether cable broadband providers can be forced to open their networks to other Internet providers.
1,France's Renault to invest 570 million dollars in South Korea (AFP),AFP - French auto giant Renault SA said it will invest some 570 million dollars in South Korea over the next three years as part of its global strategy to become a key player in Asia.
2,Phillies Reportedly Set to Fire Bowa,"Phillies Manager Larry Bowa will be fired at the end of the season and pitching coach Joe Kerrigan will resign, two newspapers reported Saturday."
2,Federer Receives Walkover Into Quarters, NEW YORK (Reuters) - Top seed Roger Federer reached the  quarter-finals of the U.S. Open without hitting a ball when  Andrei Pavel pulled out with a back injury Monday.
2,Done -- and 1,"Where a day earlier there had been pleasure over the news that the Deutsche Bank Championship had committed to two more years at TPC Boston, yesterday there was a hint of a letdown -- that the final round had to end."
2,White Finalist for a Second Heisman Trophy (AP),AP - Jason White has a chance to join Archie Griffin as a two-time Heisman Trophy winner.
4,Technology Challenges Sprint-Nextel Merger (AP),AP - The proposed merger of Sprint Corp. and Nextel Communications Inc. could face a rocky start as the companies work to run and eventually merge two wireless technologies without breaking the bank or losing customers.
1,Islamic rebel convicted,"MAKHACHKALA, Russia -- An ideological aide to Chechen rebel warlord Shamil Basayev was convicted yesterday of involvement in a 1999 raid in the southern Russian region of Dagestan."
2,Hoyas Fall Short,Georgetown's offense sputters in a 17-6 loss to Lafayette on Saturday. The defeat drops the Hoyas to 1-1 and keeps them from their first 2-0 start since 1999.
4,SCO Finds a Drop of Common Sense?,"SCO, possibly one of the few companies to regard litigation as its main revenue stream, is considering scrapping plans to launch a corporate  quot;pro-SCO quot; law and review site."
4,Game warnings  #39;should be clearer #39;,"Warnings on computer games are not big enough, and more needs to be done to help parents understand age limts, a government minister has said."
2,Delhomme at head of QB Class of  #39;97,CHARLOTTE -- Carolina Panthers quarterback Jake Delhomme only remembers one thing about the 1997 draft -- that he wasn #39;t going to be in it.
3,Corus posts first interim profits,The steel group Corus today announced pre-tax profits of 163m for the six months to the end of June - its first interim profits since its formation in 1999.
1,Hurricane Ivan Rolls Towards Cuba,"GEORGE TOWN, Cayman Islands - Hurricane Ivan pummeled the Cayman Islands with floodwaters that swamped homes and fierce winds that ripped off roofs, then strengthened to an extremely dangerous Category 5 storm as it headed for western Cuba on Monday.    The slow-moving hurricane, one of the strongest on record to hit the region, killed at least 65 people across the Caribbean before reaching the Caymans and threatens millions more in its projected path..."
4,PlayStation Portable spoils gamers.,"Sony Computer Entertainment Inc. (SCE) made another hit. After optimizing the PlayStation 2 multiple times, they now decided to give the Portable market a chance."
2,Rusty McNair leads Titans over Jaguars,"McNair threw a touchdown pass, directed two other scoring drives as the Titans (4-6) beat the Jacksonville Jaguars (6-4) 18-15 Sunday."
4,Report: VoIP to Top 12M Homes by 2009,"The number of US households using Voice over IP (define) will rocket from 400,000 to 12 million over the next five years, a new report from JupiterResearch predicts."
2,Jimenez ends Langers run,WENTWORTH: European Ryder Cup captain Bernhard Langer #39;s exploits in the World Match Play Championship finally came to an end here yesterday when he lost 2 and 1 to Miguel Angel Jimenez in their quarter-final clash.
4,The New Republic Endorses Kerry!,"\\""There was a time, in the aftermath of September 11, when this magazine liked\what it heard from George W. Bush. He said America was at war - not merely\with an organization, but with a totalitarian ideology. And he pledged to\defeat Islamist totalitarianism the same way we defeated European\totalitarianism, by spreading democracy. For a publication that has long\believed in the marriage of liberalism and American power, this was the right\analysis. And its correctness mattered more than the limitations of the man\from which it came.""\\""Three years later, it has become tragically clear that the two cannot be\separated. The president's war on terrorism, which initially offered a\striking cont ...\\"
1,New Ukraine Poll Looks Likely Way Out of Crisis, KIEV (Reuters) - A new Ukrainian poll of some sort looks  increasingly likely once again on Thursday as parliament and  the Supreme Court press ahead with efforts to resolve a  national crisis over a disputed presidential election.
3,Progress Software Avoids Crash and Burn,"Progress Software produces results in a tough market, but investors really don't care."
4,Anti-spam screensaver scrapped,A controversial campaign by Lycos Europe to attack websites run by spammers has been shut down.
3,Column: M A Rankings Under Scrutiny," NEW YORK (Reuters) - Investment banks are in the midst of  the annual fight for bragging rights as the biggest dealmakers  of the year, but this time the rankings -- a key factor in  winning new business -- are under intense scrutiny."
2,IOC warns against venue delays,"Beijing should not wait too long to complete venues for the 2008 Olympics, a top official from the International Olympic Committee said in the capital yesterday."
2,"NL Wrap: Sosa Hits 568th Homer, Cubs Eclipse Astros (Reuters)",Reuters - Sammy Sosa grabbed his 568th career\homer and Aramis Ramirez followed up with another third-inning\blast to guide the Chicago Cubs to an 8-3 win over the Houston\Astros in the National League (NL) Thursday.
1,Israeli Soldier Shot Dead in Gaza Clash -Army (Reuters),"Reuters - Two Palestinian gunmen fired on an Israeli\army outpost in the northern Gaza Strip on Thursday, killing a\soldier before being shot dead, a military spokeswoman said."
3,Mirant appoints Michele Burns to head restructuring,SAN FRANCISCO (CBS.MW) -- Electricity merchant Mirant (MIRKQ) said Thursday it appointed Michele Burns chief restructuring officer and the company #39;s main representative as it puts together a plan to get out of bankruptcy.
4,"Don't use Google desktop search in your business, warns Gartner","Well, hang on there, let's give them a chance"
3,"Temperatures Dip in Europe, Sending Price of Oil Up 4.8","The price of crude oil surged 4.8 percent in New York yesterday, the biggest rise in more than five months, on concern that cold weather in Europe will draw heating oil from the United States."
4,Web Server Takedown Called Speech Threat,"Devin Theriot-Orr, a member a feisty group of reporter-activists called Indymedia, was surprised when two FBI agents showed up at his Seattle law office, saying the visit was a ""courtesy call"" on behalf of Swiss authorities."
3,YUKOS Seeks U.S. Bankruptcy Protection," MOSCOW (Reuters) - Russian oil group YUKOS has filed for  bankruptcy protection in a U.S. court in an attempt to stop  Russia's government from auctioning off its main production  unit on Dec. 19, it said on Wednesday."
3,Consumer sentiment weakens in September,"NEW YORK - US consumer sentiment took a surprise spill in September, according to a survey released Friday, suggesting Americans continue to be uncertain about the economic outlook and the job market."
2,Steroid scandal will be given lip service,"Do you assume this raging scandal will be enough to overhaul Major League Baseball #39;s laughable drug policy? If so, you must think Bill Clinton didn #39;t have sex with that woman."
2,"Shots Are Falling, and Sonics Are Rising",The perimeter-conscious (and unconscious) Seattle SuperSonics are off to their best start since the 1993-94 season.
3,General Mills posts loss but Wall St. firms fare well,"Higher ingredient prices and restructuring costs pushed General Mills #39; first-quarter earnings down 19 percent, the cereal giant reported Tuesday."
1,"Fear keeps Darfur people in camps or town, says UK minister (AFP)",AFP - A junior British minister said that people living in camps after fleeing their villages because of conflict in Sudan's Darfur region lived in fear of leaving their temporary homes despite a greater presence now of aid workers.
3,Report: Symantec in Talks With Veritas,"SAN JOSE, Calif. - Symantec Corp. #39;s reported interest in acquiring Veritas Software Corp. for more than \$13 billion would represent the computer security giant #39;s biggest step yet beyond its core businesses "
1,"Briton begs for life on video, asks Blair #39;s help","Baghdad -- A militant group that beheaded two American engineers this week posted a video on the Internet on Wednesday showing a third hostage, Kenneth Bigley, a Briton, pleading for his life."
3,American Eagle plans 1st cash payout,Teen clothier American Eagle Outfitters Inc. has decided to pay shareholders its first cash dividend on the heels of a solid back-to-school performance.
4,Microsoft continues Windows XP SP2 distribution,"Continuing the roll-out of Windows XP Service Pack 2 (SP2), Microsoft Corp. on Wednesday began pushing the security-focused update to PCs running Windows XP Professional Edition "
2,Dirrell Boosts American Title Hopes in Boxing, ATHENS (Reuters) - Middleweight Andre Dirrell boosted the  United States' slim hopes of winning an Olympic boxing title by  booking a place in the semi-finals with a narrow victory over  Cuba's Yordani Despaigne Wednesday.
4,Macromedia Launches Flex Builder Tool,"Macromedia has launched Flex Builder, a development tool for its Flex application-development platform. The new tool will help speed creation of rich Internet applications, including visual data "
4,HYDROGEN MILESTONE,"Turning water into hydrogen energy... A major R  amp; D milestone could help the nation advance toward a clean hydrogen economy. It #39;s a project the INEEL and a Salt Lake ceramics company are collaborating on, using "
1,"Tokyo Stocks Higher, Dollar Up Vs. Yen (AP)",AP - Tokyo stocks edged higher Friday morning amid some bargain-hunting in technology and auto companies. The U.S. dollar was higher against the Japanese yen.
1,Rebels Set Off Land mine in Indian Kashmir; 11 Dead,"Separatist militants set off a powerful land mine in Indian Kashmir killing eleven people, including nine soldiers in one of the biggest guerrilla attacks in weeks, police said on Sunday."
2,Lilly outduels Pedro,"Toronto, ON (Sports Network) - Ted Lilly threw a three-hit shutout with a career-high 13 strikeouts to lead the Toronto Blue Jays to a 3-0 victory over the Boston Red Sox at SkyDome."
3,Hurricane Damage to Hit Allstate Profits," NEW YORK (Reuters) - Allstate Corp. &lt;A HREF=""http://www.investor.reuters.com/FullQuote.aspx?ticker=ALL.N target=/stocks/quickinfo/fullquote""&gt;ALL.N&lt;/A&gt;, the No. 2 U.S.  home and auto insurer, warned on Wednesday its third-quarter  profits would fall well short of expectations due to more than  \$1 billion in hurricane-related payouts."
1,New row threatens top EU body,A new row engulfs European Commission over an undisclosed conviction of one of its members.
4,"Houston, we have a winner: Allen #39;s group claims X Prize","MOJAVE, Calif. - A \$20 million, private investment in manned space flight earned a \$10 million return yesterday when a stubby, white rocket captured the X Prize by soaring to the edge of space for the second time in less than a week."
2,STAR WARS II,When will Arsene Wenger and Alex Ferguson ever bury the hatchet? Looks like never as the bitter tit-for-tat goes unabated. By Jeffrey Low.
1,Conflicts across Iraq as powerful explosives disappear,"Conflicts and bombings still rampaged across Iraq on Monday, killing at least 16 people including an American soldier and an Estonian trooper."
4,Floppy Disk Becoming Relic of the Past,"Like the penny, the floppy drive is hardly worth the trouble, computer makers say. &lt;FONT face=""verdana,MS Sans Serif,arial,helvetica"" size=""-2""\ color=""#666666""&gt;&lt;B&gt;-AP&lt;/B&gt;&lt;/FONT&gt;"
1,Website: Iraqi Militants Kill Turkish Hostage,Islamic militants in Iraq apparently have killed a Turkish man whom they took hostage last month. Mr. Kumdereli was abducted with another Turkish truck driver in mid-August.
2,Comfortable Starts for Federer and Mauresmo at Open, NEW YORK (Reuters) - Roger Federer launched his campaign  for a third grand slam title of the year on Monday as the U.S.  Open began under cloudy skies at Flushing Meadows.
2,Melvin Fired,"Bob Melvin #39;s two-year reign as manager of the Seattle Mariners came to an end Monday morning, as the Mariners announced his dismissal at a press conference at Safeco Field."
2,What we learned,"Auburn: Every team worth its shoulder pads strives for offensive balance, and the Tigers have the potential to be one heck of a balanced team."
2,Ford Makes Four-Year Commitment,"Ford made a four-year commitment to the world rally championship Tuesday, ending fears that they could pull out of that series as well as Formula One."
2,Edmistone eases into semi-finals,Australia #39;s Jade Edmistone has qualified fastest for the semi-finals of the women #39;s 50 metres breast stroke at the World Short Course Swimming Championships in Indianapolis.
2,Cost Estimate Jumps,"The cost of building a stadium and renovating RFK Stadium could be \$91 million more than city officials initially estimated, according to an analysis released Wednesday."
2,Renault F1 Team prepares for Lyon spectacle,The Renault F1 Team Roadshow will touch down in Lyon on Sunday 5 September 2004 for a festival celebration of Renaults rich motorsport heritage.
3,American Airlines lowers Miami fares,"To draw business from smaller airlines operating out of a nearby airport, American Airlines has lowered its fares at Miami International."
3,"Stocks Flat as Oil, Retail Sales Weigh","US stocks opened little changed on Tuesday as concerns over higher oil prices damaging corporate profits weighed on investor sentiment, while a dip in retail sales also dampened the mood."
3,OPEC Chief: Concerned with Oil Price Rise," JAKARTA (Reuters) - OPEC President Purnomo Yusgiantoro said  on Friday he was concerned with the continuing rise in global  oil prices, but the cartel had not yet seen a cost-driven  increase in inflation."
4,Mass. Gets Electronic Gun Fingerprinting,"With a quick electronic scan of a fingerprint, gun shop owners in Massachusetts will know immediately if a customer is eligible to buy a weapon, using a system that officials say is the first of its kind in the nation."
4,US Judge Rejects Law to Block Child Porn on Web,"A Pennsylvania law allowing the state to force Internet service providers to block access to child pornography sites is unconstitutional, a federal judge ruled on Friday."
2,"Offence comes alive, Dolphins get 1st win","Jay Fiedler played an efficient game and the Dolphins became the NFL #39;s last team to win, posting a 31-14 victory over the St. Louis Rams."
3,FCC Approves Cingular #39;s AT amp;T Wireless Bid,The US Federal Communications Commission said on Tuesday it has conditionally approved Cingular Wireless #39; \$41 billion acquisition of AT amp;T Wireless Services Inc.
3,"Mitsubishi Motors, Merrill Lynch tie up over US auto loans",TOKYO : Troubled Japanese automaker Mitsubishi Motors Corp. will tie up with Merrill Lynch and Co. in North American financing operations as part of its business rehabilitation efforts.
1,"Russian Mine Blast Kills 10, Injures 30"," MOSCOW (Reuters) - A methane blast in a mineshaft in  Russia's Siberia killed at least 10 people and injured 30 on  Thursday, a government spokesman said."
2,News / What The Papers Say,Ruud van Nistelrooy could still face a UEFA ban after his alleged elbow on Sparta Prague defender Pavel Pergl. The United striker thought he had escaped when the referee cleared him of misconduct in Tuesdays game.
1,African Union Forces to Deploy Fully in Darfur by Yearend,"KHARTOUM, 5 December 2004 - African forces should be fully deployed to Sudans troubled Darfur region by the end of the year despite some delays in building the infrastructure to house them, the new head of the African Union mission said yesterday."
3,Update 4: Ex-Enron Treasurer to Testify at Trial,"A former Merrill Lynch executive pointed to a verbal buyout agreement with Enron Corp. in saying he might support an  quot;unsecured deal quot; with another company, according to an e-mail presented to jurors in an ongoing conspiracy and fraud trial."
2,American Bowl returns to Tokyo in 2005,"The Atlanta Falcons and Indianapolis Colts will begin the preseason Aug. 6 in the American Bowl in Tokyo, the record 12th time an NFL game will be played in the city."
