Class Index,Title,Description
3,GM to invest \$200 mln in Saturn plant,"SAN FRANCISCO (CBS.MW) - General Motors said late Thursday that it plans to invest \$200 million to upgrade and expand its Fairfax, Kansas manufacturing plant for production of the 2007 Saturn midsize car, which will begin in the second half of 2006."
4,Review: AMD Athlon 64 FX55,AMD has proved time and time again that its processors offer better performance than the competitions - and better value for money too.
1,U.S. Military Seeks Plane With Six Aboard (AP),AP - The U.S. military said Tuesday that it was searching for three civilian crew members and three military passengers who were aboard an aircraft that went missing over Afghanistan.
4,Danger of Image-Borne Viruses Looms,"Hackers are close to finding a way to spread harmful computer viruses just by getting people to open an e-mail message or visiting an infected Web site, computer security experts warned yesterday."
2,NFL Wrap: Steelers End Bills' Playoff Hopes," ORCHARD PARK, N.Y. (Sports Network) - Jeff Reed kicked five  field goals and James Harrison returned a fumble for a  touchdown, as the Pittsburgh Steelers completed the best season  in franchise history and knocked the Buffalo Bills out of  playoff contention with a 29-24 victory at Ralph Wilson  Stadium."
1,Abortion provokes ethics clash for US presidential contenders (AFP),AFP - President George W. Bush vowed Friday that no public money would be spent on abortion -- which with embryonic stem cell research provoked an impassioned ethical clash with Democratic challenger John Kerry.
2,AROUND THE HORN: Bonds tested:  #39;It will clear my name #39;,SAN FRANCISCO -- Barry Bonds hopes his random steroid test last week will remove suspicion that he uses performance-enhancing drugs.
4,"Windows kernel, LSASS flaws fixed","As anticipated, Microsoft today released five security bulletins rated  quot;important. quot; All five fix vulnerabilities in Windows that could have been exploited by attackers to "
2,Larsson #39;s season in jeopardy,"Barcelona, Spain (Sports Network) - Barcelona #39;s Henrik Larsson appears likely to miss the remainder of the season after it was discovered that he tore the anterior cruciate ligament in his left knee."
1,Sectarian Tensions Simmer in Lebanon,"The arrest last month of Neameh Qayssamani, a newly elected member of the municipal council in Lebanon, and dozens of other men in the Chouf Mountains recalled a fearful time most people believed had passed forever."
2,Mallorca coach Floro on the brink,"Real Mallorca president Mateo Alemany and his board spent yesterday in talks over the future of coach Benito Floro. Sunday #39;s defeat at Real Sociedad has heaped more pressure on Mallorca directors to act, despite "
4,"IBM, AMD Extend Alliance","which had been due to expire next year -- will see AMD pay IBM fees from \$250 million to \$280 million through December 2008, while "
1,De Niro no-show for Italian award,Robert De Niro fails to show up at an awards ceremony in Milan and a press conference in Rome.
1,Yankees Lead BoSox 1-0 in Game 2 of ALCS,"NEW YORK - Gary Sheffield hit an RBI single, and the New York Yankees took a 1-0 lead over Pedro Martinez and the Boston Red Sox in Game 2 of the AL championship series Wednesday night.    New York starter Jon Lieber allowed only one hit and a walk, stifling Boston's sluggers just as Mike Mussina did the night before..."
1,Small Blast Rocks Mayor's Office in France (AP),AP - An explosion rocked the mayor's office in the southwestern French city of Bordeaux early Thursday. No one was injured.
1,Prosecutor Asks for Eight Years for Berlusconi,An Italian prosecutor asked a court on Friday to sentence Silvio Berlusconi to eight years in jail for bribing judges as the prime minister's four-year corruption trial reached its closing stages.
1,NFL Suspends Lewis Two Games for Drug Case,"OWINGS MILLS, Md. - Baltimore Ravens running back Jamal Lewis was suspended for two games without pay by the NFL for violating the league's substance abuse policy, one day after pleading guilty to trying to set up a drug deal four years ago..."
4,"Prompted by government policy, KTF embraces Java",KTF is the last of the major South Korean carriers to license Java as required by the Wireless Internet Platform for Interoperability.
2,Ponting ruled out of second Test as well,"SYDNEY, Sep 30: Australian skipper Ricky Ponting was also ruled out of the second Test against India, Cricket Australia said Thursday after receiving medical advice on his injured thumb."
3,Fact and Comment (Forbes.com),"Forbes.com - The news from Iran is grim. This Islamic dictatorship--the biggest source of terrorist training and financing in the world and the nation that's doing all it can to stir up trouble in already combustible Iraq--is clearly on the cusp of becoming a nuclear power. The clerical fascists running the country have dropped just about all pretense of their atomic programs being energy-related only. Tehran announced in July that it had resumed making the centrifuges needed to produce highly enriched uranium, a key ingredient for nuclear bombs. ..."
2,Revolution hope history repeats itself,"Based on their finishes in the last two MLS regular seasons, the Revolution could be in a position of strength. Though the Revolution (5-11-9) are in last place in the overall standings, their recent track record in the final five games of the season provides hope."
3,"Crude oil prices on the rise, airlines squeezed further","Crude oil prices rose back up over \$53 a barrel Tuesday, signaling more bad news for an airline industry already facing record-high fuel prices."
2,"Stout defense, Broncos #39; bungle propels Jaguars 7-6","The Jacksonville Jaguars are accustomed to playing close games. Now they #39;re finding ways to win them, too. The Jags lost three games in the final minute last season and finished 5-11."
2,Belichick Seems to Praise Jets With a Wink and a Nod,"Those were a handful of observations made Wednesday by New England Coach Bill Belichick, not about his Patriots, winners of 20 straight games, but about the Jets, the surprising owners "
1,After the offensive Gazans survey the devastation,"Relatives of Ismal Assawalhi, 70, mourning him at his funeral in the Rafah refugee camp in the southern Gaza Strip, Three Palestinians, including Assawalhi, were killed in a pre-dawn Israeli air raid on Rafah during Israels recent offensive in the "
4,Halo 2 Xbox game leaks over the Net,"According to reports, copies of the eagerly awaited Halo 2 Xbox game made an impromptu debut last night on Usenet groups and pirate sites."
4,Dell trims PC prices for business clients,Dell cut prices on some servers and PCs by as much as 22 percent because it #39;s paying less for parts. The company will pass the savings on components such as memory and liquid crystal displays 
1,Founder of United Arab Emirates dies,"DUBAI, UAE - The man who forged the ultramodern United Arab Emirates out of a federation of seven tiny Persian Gulf states has died."
3,"Korean FTA concludes, progress with India","FROM today, almost 75 per cent of Singapore #39;s domestic exports to South Korea, which amount to more than \$3 billion, will enjoy immediate tariff elimination."
4,HDTV 'Starter' Kit for PC Comes with Some Kinks (Reuters),"Reuters - High-definition television can\show the sweat beading on an athlete's brow, but the cost of\all the necessary electronic equipment can get a shopper's own\pulse racing."
2,Former MVP Caminiti Dies of Heart Attack at 41," LONDON (Reuters) - Former National League Most Valuable  Player Ken Caminiti, who in 2002 admitted he used steroids,  died of a heart attack in New York on Sunday, Major League  Baseball reported on its Web Site."
1,420-Pound Teen to Get Free Gastric Bypass,HOUSTON - Two doctors and a hospital offered a free gastric bypass to a 420-pound teenager after another medical center canceled the procedure because his insurance would not pay for it.    Doctors at Obesity Surgery Specialists said 16-year-old Brandon Bennett needs the operation for a chance at a healthy life...
4,Google can now take you inside seven great libraries,This is welcome news for researchers as their favorite web search engine Google will now scan the entire collections of seven prestigious libraries and make these pages available to Google users.
2,NHL cancels All-Star Weekend,"The NHL lockout forced the cancellation of this season #39;s All-Star game, scheduled to be held in Atlanta in February. Wednesday #39;s announcement that the midseason showcase would not be held came on the 49th "
4,Nevada's Seamless E-Vote,"The success of last week's primary election using touch-screen voting machines heartens officials in other states, where e-voting has been problematic. Still, the Silver State may be in a unique situation."
3,"EU Lifts U.S. Sanctions, Contests Taxes"," BRUSSELS (Reuters) - The EU called off its sanctions on \$4  billion worth of U.S. goods on Monday after Washington repealed  illegal export tax subsidies, bringing some balm to  transatlantic ties wounded by a battle over Airbus and Boeing."
1,Saudi forces thwart protest march,"Saudi security forces thwarted planned protest marches in the kingdom #39;s two main cities on Thursday, deploying in force in the capital Riyadh and arresting at least a dozen people in the Red Sea port of Jeddah."
1,8 French Soldiers Killed in Ivory Coast,"Warplanes bombed French peacekeepers Saturday, killing eight French soldiers and wounding 23, and French forces responded by shooting down government aircraft, French "
2,"4 of a kind for 1st-place Twins, 5-3","On Monday afternoon, Tigers owner Mike Ilitch praised Ivan Rodriguez #39;s leadership. In the fourth inning Monday night, Rodriguez showed plenty of it."
1,Europe lines up for TV innovation,"High-definition television is set to take off in Europe in the coming year, say TV executives."
1,Newspaper: Egypt Attackers Fled on Foot (AP),"AP - The attackers in three explosions on Egypt's Sinai Peninsula last week all fled minutes before their vehicles blew up, Egypt's biggest newspaper reported Wednesday, contradicting reports that suicide bombers carried out the attacks."
1,Protesters twice disrupt Blair #39;s speech at Labor #39;s conference,"Protesters have twice disrupted British Prime Minister Tony Blair #39;s speech at his ruling Labor #39;s annual conference in Brighton, southern England, as thousands of pro-hunt campaigners "
1,Arafat: A leader without a conscience,"I will not shed a tear for the passing of Yasser Arafat, a man who invented modern terrorism. He was a leader who taught generations of Palestinians how to hate and how to kill."
3,Market on record run,"THE stock market continued on its bullish performance by noon today, extending recent record highs with BHP Billiton in the vanguard."
4,Secure Flight Takes Flight: Its About Time,"D., and Alane Kochems. The Department of Homeland security has announced a new program, Secure Flight, designed to screen flight passenger data and flag possible terrorists before they board an airplane."
4,Verizon Betting on  A Bundle (washingtonpost.com),"washingtonpost.com - Verizon Communications Inc., the nation's largest telephone company, announced yesterday it is digging up streets and stringing wire in six states, including Washington's Maryland and Virginia suburbs, to build a new fiber-optic network that will deliver high-speed Internet service and cable-style television to homes and businesses."
3,Are Pests Plaguing PETsMART?,"Sales were lower than expected, and the quality of earnings is in question."
1,"Asia, Europe Seek Better Business Ties","Asian and European business leaders at a joint forum pushed for greater trade between their regions Thursday, with Asians calling for more transfer of technology to their countries and Europeans demanding greater Asian investment."
3,"With Charley on Their Minds, Floridians Brace for Round 2","Al Cialella is from Philadelphia, where he always thought of  quot;sturdy quot; oak trees as symbols of strength. He never knew that in central Florida, the water table "
4,Hubble Captures Cat #39;s Eye Nebula,"Sept. 9, 2004 - Like an onion cut in half, the concentric shells surrounding the Cat #39;s Eye Nebula are visible in the newest image from the Hubble Space Telescope."
1,"U.S. Image Slides, but Americans Popular (AP)","AP - America's popularity around the world has taken a beating in recent years, according to a set of coordinated polls conducted in 10 different countries. But the survey also found that despite widespread animosity toward President Bush, huge majorities said they have a good opinion of Americans."
3,Source: EU-Coke Antitrust Deal Pending,The European Commission plans to announce a formal proposal settling a long-running antitrust case against the world #39;s largest soft drinks maker Coca-Cola 
4,Taiwan #39;s Acer Inc. Reshuffles Leadership,Taiwanese high-tech giant Acer Inc. on Wednesday announced a leadership reshuffle and the retirement of Stan Shih - the company #39;s founder and a major figure in Taiwan #39;s bid to dominate the personal computer industry.
2,"Horse Racing: Cream of US, Europe to Clash in Texas"," GRAND PRAIRIE, Texas (Reuters) - Betting on horses was  banned in Texas until as recently as 1987. Times have changed  rapidly since. Saturday, Lone Star Park race track hosts the  \$14 million Breeders Cup, global racing's end-of-season  extravaganza."
1,US diplomat fatally shot near Green Zone; bomb kills 3,"BAGHDAD -- An American diplomat was killed yesterday in an attack near the heavily fortified sector of central Baghdad known as the Green Zone, US officials said."
4,California stem-cell move could be test for Scripps,"In the increasingly competitive battle for biotech prominence, California just played a trump card: Proposition 71, a voter-approved initiative to spend \$3 billion on stem-cell research over the next decade."
4,Chicago to Sell City-Related Items on EBay (AP),"AP - City officials hope there are people willing to pay plenty of money to own a vintage Playboy Bunny costume, toss green dye into the Chicago River or throw a dinner party prepared by Oprah Winfrey's chef."
2,Molik carries weight of expectation,"Is Alicia Molik the great white hope of Australian women #39;s tennis? It might be unfair to burden the 23-year-old with that tag, but following her win over Maria Sharapova in the \$1."
4,Microsoft expands mainframe pitch,"Microsoft is expanding a plan to draw mainframe customers to Windows for high-end applications. Under a program with the internal code name Mission Critical Microsoft, the company is trying to extend its current "
1,"To Pay Debt, Transit Agency Goes to Market","The M.T.A., in an effort to raise more than \$1 billion, wants to sell or lease many of its 14,000 properties."
2,Victory pays for visitors,"The mantra in the days leading up to this morning #39;s start of the 35th Ryder Cup at Oakland Hills has been pride, heart, patriotism."
2,Fla. State's Sam Won't Play in Gator Bowl (AP),AP - Florida State wide receiver Lorne Sam will not be available for the Seminoles when they play West Virginia in the Gator Bowl on Jan. 1.
3,Conoco forges alliance with Lukoil,MOSCOW ConocoPhillips won 7.59 percent of the Russian oil giant Lukoil for \$1.988 billion on Wednesday in a largely symbolic auction that still ranks as the Russian government #39;s most lucrative post-Soviet privatization.
2,India  #39;aiming for wins not records #39;,"DHAKA: India will focus on results and not records in the first Test against Bangladesh starting today, even though two of their players are on the verge of personal milestones, captain Saurav Ganguly said."
1,CRISIS IN IRAQ: THERE #39;S NO HUMANITY,THE Red Cross yesterday launched a blistering attack on both sides in the war in Iraq. The organisation blasted US troops and Iraqi rebels for their  quot;utter contempt for humanity quot; as the country continues to be torn apart by violence.
3,Continental isn #39;t funding its pension plan this year,"Continental Airlines, the fifth-largest US carrier, yesterday said it will skip contributions to employee pension plans this year, taking advantage of a law enacted in April to conserve cash."
3,Oil Holds Firm as Dealers Digest Iraq,World oil prices held firm on Friday after pipeline sabotage in northern Iraq kept up supply fears that have revived a powerful price rally.
1,Zimbabwe Opposition Leader Found Innocent of Treason (Update5),"Morgan Tsvangirai, leader of Zimbabwe #39;s opposition and the strongest ever challenger to the 24-year rule of President Robert Mugabe, was found not guilty of treason by the country #39;s High Court."
3,WPP #39;s Mega Ad Buy,"What are weekends for? In the mergers and acquisitions game, it is usually meant for structuring mega deals. That was the case with WPP Group #39;s (Nasdaq: WPPGY) \$1."
3,Centene Takes a Dose of Deal-Making,The mergers and acquisitions continue apace in the managed care industry.
2,Henman has skills to flush Coria from baseline lair,"Two factors are in Tim Henman #39;s favour here today as the British No 1 attempts to defeat Guillermo Coria, of Argentina, to give himself a chance of advancing beyond the round-robin stage at the Masters Cup."
4,"In Texas, 28,000 Students Test an Electronic Eye","Hoping to prevent the loss of children, a few schools have begun monitoring student movements using technology similar to that used to track livestock and retail shipments."
2,Captain Thomas Muster hopes for Austrian win,Austria hopes to capitalize on its home-court advantage and tough preparations to defeat Britain in this week #39;s Davis Cup World Group playoffs captain Thomas Muster said Wednesday.
1,Genesis Space Capsule Crashes Into Desert,"DUGWAY PROVING GROUND, Utah - The Genesis space capsule, which had orbited the sun for more than three years in an attempt to find clues to the origin of the solar system, crashed to Earth on Wednesday after its parachute failed to deploy.    It wasn't immediately known whether cosmic samples it was carrying back as part of a six-year, \$260 million project had been destroyed..."
2,Do You Remember Henin-Hardenne? Didn #39;t Think So,"S if the lingering effects of a viral infection and a more recent cold weren #39;t bad enough, Justin Henin-Hardenne couldn #39;t quite shake her Olympic hangover, a 31-year-old Israeli journeywoman "
2,Forest turn Clough #39;s wake into pageant,"They came in their thousands, many in replicas of that tatty, old green sweatshirt, to mourn the passing of the man who, for 18 years, made the name Nottingham Forest synonymous with success."
1,Two killed in bomb blast south of Baghdad,"A car bomb has exploded in the Iraqi town of Suwayra, south of Baghdad, killing two people and wounding 10, the Interior Ministry says."
3,Is Marsh #39;s board responsible for its troubles?,"The company is wrestling with its third scandal in just over a year, raising questions about whether board members were doing an adequate job."
1,Annan gets ovation at UN despite US attack,"The whiff of scandal has been swirling around the UN for months. But now Kofi Annan himself, the man handpicked by the Americans to lead the organisation seven years ago, is on the ropes."
1,Israeli Soldiers Kill Palestinian in West Bank Raid,Israeli troops shot dead an unarmed mentally handicapped Palestinian during a raid on Tuesday on a West Bank refugee camp on the fourth anniversary of a Palestinian uprising.
1,"Sudan's government, rebels call on world to provide 300 million dollars in aid (AFP)",AFP - Representatives of the Sudanese government and the southern rebel Sudan People's Liberation Movement (SPLM) urged the world community to provide 300 million dollars (244 million euros) in aid to cover emergency needs.
2,Lazio Complete Formality,A good Lazio side had no difficulty in administrating the second leg of the Uefa Cup first round in order to qualify to the next stage.
4,Microsoft testing new e-mail subscription service,Microsoftis testing a new subscription Hotmail service that includes 2GB of e-mail storage and a copy of Outlook 2003 to access the service from the desktop.
1,Zarqawi Aide Killed During US Air Strike,"WASHINGTON, Oct 26, 2004 -- Coalition forces launched precision strikes on a safe house in Fallujah early this morning, killing an associate of Abu Musab al-Zarqawi #39;s terrorist organization, military officials in Baghdad reported today."
2,Surfers Paradise: Shootout,"Pirtek Racing #39;s Marcos Ambrose won a fiery first race of the Gillette V8 Supercar Challenge at this year #39;s Lexmark Indy 300, clashing heavily with Kmart Racing #39;s young gun Rick Kelly both during and after the race on the Gold Coast today."
2,Knicks Nudge Rockets 93-92 at Buzzer,"New York Knicks #39; Jamal Crawford (11) goes up to shoot the game-winning three-point shot as Houston Rockets #39; Jim Jackson (21) defends during the fourth quarter Thursday, Nov. 18, 2004 in Houston."
1,Russia May Ratify Kyoto Protocol in Oct. -- Minister," MOSCOW (Reuters) - The Russian government expects  parliament to ratify the Kyoto Protocol this month in a move  allowing the long-delayed climate change treaty to come into  force worldwide, a senior minister said Monday."
2,Americans lose second beach volleyball match,"ATHENS, Greece (Ticker) -- The dream of a second consecutive beach volleyball gold medal has become all but impossible for American Dain Blanton. "
2,Golds All Round for Athens from IOC Chief,Olympic supremo Jacques Rogge Sunday offered gold medals all round to Athens for organizing a superb Olympics after years of doom and gloom leading up to the opening.
4,New computer technology replaces mouse control with facial &lt;b&gt;...&lt;/b&gt;,"HAMISH ROBERTSON: Staying with computers, that world was opened up to many people, especially those with disabilities, by the invention of voice recognition technology."
1,Indons detain couple in connection with embassy bombing,"Police have detained a man and his wife in the port city of Surabaya and are questioning them in connection with last week #39;s deadly bombing at the Australian embassy, a spokesman said Thursday."
2,Birmingham to sell Gronkjaer to Atletico Madrid,"Birmingham City have agreed to sell Denmark winger Jesper Gronkjaer to Spanish side Atletico Madrid, the Premier League club says."
2,BCS Standings Unchanged With Auburn No. 3 (AP),"AP - Auburn needs an upset. The Tigers are still stuck behind first-place Southern California and second-place Oklahoma in the Bowl Championship Series standings, heading into the final weekend before the national title game is decided."
3,Murdoch: Plans Cable Rival For  #39;Disappointing #39; CNBC,"Rupert Murdoch, sunny news junkie. After the annual shareholder meeting of Fox Entertainment Group (nyse: FOX - news - people ), Murdoch said he saw a niche for a new cable business news channel that #39;d offer "
1,Pakistan PM makes way for Aziz,Pakistan  #39;s caretaker prime minister has resigned and his cabinet dissolved in a formality to allow the finance minister to take over as head of the government.
1,Court Voids Law Keeping Woman Alive,The court said that Gov. Jeb Bush violated separation of powers when he signed a law to keep Terri Schiavo alive.
1,Pakistan foils al-Qaeda attacks,"PAKISTANI security agencies have arrested nearly a dozen al-Qaeda-linked terror suspects who allegedly plotted to attack key sites including military headquarters, the US embassy and parliament."
2,Chiefs-Broncos Game Could Be Pivotal (AP),"AP - After finishing 13-3 last season, the Kansas City Chiefs are thinking Super Bowl. The Denver Broncos always think Super Bowl, even though they've made the playoffs just twice in the five years since John Elway retired and haven't won a postseason game. So while it may be premature to think of their meeting in Denver on Sunday night as an AFC championship game preview, it could be critical in the AFC West, where the Chiefs and Broncos figure to battle for the title."
1,Australian terrorist seeks deal to testify in foreign trials,"SYDNEY : Australia #39;s first convicted terrorist, who confessed to conspiring with Al-Qaeda to blow up the Israeli embassy in Canberra, wants a deal in exchange for testifying against terror suspects in foreign courts. "
2,GB boss defends swimmers,Britain's swimming coach Bill Sweetenham defends his team's record in Athens.
2,"US, Russia, China at the Top of the Table","ATHENS -- After 16 days of competition and 301 events, the United States finished atop the medal charts for the third straight Summer Olympics, with Russia the overall runner-up and China second in gold medals -- its best showing ever and the leading edge "
3,Quanta announces 7.2 drop in profit,"Quanta Computer Inc., the world #39;s biggest notebook computer maker, reported an unexpected 7.2 percent decline in second-quarter profit."
2,Happy return for Youkilis,"If you don't think Kevin Youkilis is happy to be back in the Red Sox lineup, consider this: He was in his uniform and on the field three hours before last night's game against the Devil Rays."
1,Egypt to let foreign companies manage state enterprises (AFP),"AFP - Egypt is ready to let foreign companies manage state-owned businesses but will not give up control of those it sees as strategic, President Hosni Mubarak's spokesman said."
2,Shearer: Toon have to go out and sign Rooney,"ALAN SHEARER last night stepped into the ward of words between Craig Bellamy and Newcastle over Wayne Rooney by saying,  quot;Let #39;s go out and sign him."
3,Cereal-only restaurant looks to milk new format,"How's this for thinking outside the box: a cafe with jammies-clad servers pouring cereal day and night, topping it off with everything from fruit to malted milk balls, and serving it in  quot;bowls quot; resembling takeout Chinese containers."
